{
  "schema": 1,
  "language": {
    "default": "en"
  },
  "storage": {
    "mode": "per-feature",
    "featuresRoot": "docs/features"
  },
  "tooling": {
    "packageManager": "pnpm",
    "build": "pnpm build",
    "lint": "pnpm lint",
    "test": "pnpm test",
    "format": "pnpm format"
  },
  "mcp": {
    "detected": []
  },
  "codeReview": {
    "skills": ["code-review"]
  },
  "tasks": {
    "maxContextTokens": 250000,
    "charsPerToken": 4,
    "maxElements": null,
    "maxAcceptanceCriteria": null,
    "granularityBias": "split"
  },
  "implement": {
    "branchTemplate": "feat/{slug}",
    "maxRepairIterations": 3,
    "engine": "subagents",
    "worktreeSetup": [],
    "worktreeCleanup": "always"
  },
  "prs": {
    "model": "stacked",
    "grouping": "slice",
    "baseBranch": "main",
    "verifyPerPrCi": false
  },
  "validation": {
    "allowWaiver": true,
    "dimensions": {
      "spec": ["structural"],
      "tasks": ["frontmatter", "self-contained", "sc-integrity", "coverage"]
    }
  },
  "detectedAt": "2026-07-05T00:00:00Z"
}
